title,date,article
"외화증권 보유액 사상 최대...'박스피'에 지친 개미들, 삼성전자 팔고 테슬라 산다",2021.11.25 10:43,"['국내 증시가 지지부진한 사이 투자자들의 발길이 해외 증시로 향하면서 외화증권 보유액이 연일 최고치를 경신하고 있다.', '25일 한국예탁결제원 증권정보포털에 따르면 이달 24일 기준 외화증권(주식·채권) 보관잔액은 1026억5000만달러(약 121조8000억원)로 집계됐다. 3분기말 897억2000만달러였던 외화증권 규모는 4분기 들어 13%(100억달러) 넘게 증가하며 연일 최고치를 넘어서고 있다.', '이달 1일부터 23일까지 국내 투자자들이 가장 많이 순매수한 해외 주식은 테슬라로 나타났다. 투자자들은 테슬라 주식 22억5000만달러어치를 매수하고 18억4000만달러어치를 매도해 4억달러 순매수를 기록했다. 이어 엔비디아(3억2000만달러), 리비안(2억4000만달러), 메타(2억3000만달러), 마이크로소프트(1억5000만달러) 순으로 순매수 규모가 컸다.', '반면 국내 증시에서 개인들은 순매도로 돌아섰다. 한국거래소에 따르면 이달 들어 24일까지 개인은 2조6530억원어치를 순매도했다. 개인 투자자가 순매도로 전환한 것은 지난해 11월(2조1248억원) 이후 1년 만이다.', '개인 투자자들이 이달 들어 가장 많이 팔아치운 종목은 SK하이닉스(1조2920억원)와 삼성전자(1조1710억원)다. 이들 반도체주의 주가가 떨어지면서 이달 초 손절매가 시작됐고 최근 반도체 업황에 대한 긍정적 전망이 나오며 주가가 상승하자 대거 매도에 나선 것으로 풀이된다.', '개인들은 주가 하락에 돈을 걸고 있다. 개인은 지난 22일부터 24일까지 인버스 상장지수펀드(ETF) ‘KODEX 200선물인버스2X’를 1679억원어치 순매수했다. 이 기간 중 순매수 규모로는 네이버(2024억원)에 이어 두 번째다. 일명 ‘곱버스’로 불리는 이 상품은 코스피200 선물지수를 역으로 2배 추종하는 인버스 레버리지 ETF로, 주가가 하락할 때 수익을 낸다.']"
올 3분기 대기업 고용 '흐림'…정규직 줄고 비정규직 늘어,2021.11.23 07:34,"['코로나19 영향으로 국내 대기업의 고용이 감소한 것으로 나타났다. 정규직은 줄고 비정규직은 늘어나는 등 고용의 질도 악화됐다. IT 업종은 고용이 늘어난 데 비해 유통 업종은 줄어드는 1만명 넘게 줄어드는 등 업종별 격차도 뚜렷했다.', '23일 기업분석연구소 리더스인덱스가 국내 매출 상위 500대 기업 중 분기보고서를 제출하고 비교 가능한 313개 대기업의 고용 현황을 분석한 결과 올해 3분기 고용인원은 123만9822명으로 전년 동기(125만2652명)대비 1.02%(1만2830명) 감소했다.', '같은 기간 정규직은 1만8199명 감소한 반면 비정규직은 5369명이 늘어나는 등 고용의 질도 떨어졌다.', '조사 대상 기업의 고용 인원 중 남성이 74%, 여성이 26%였다. 그런데 고용 감소 인원 1만2830명 중 남성이 33%(4266명), 여성이 67%(8564명)로 여성 고용 감소가 두드러졌다.', '업종별로는 제약·바이오(4.1%), 증권사(3.5%), IT·전기전자(3.4%), 공기업(3.0%) 순으로 고용 인원이 증가했다. 반면, 상사(-25.1%), 유통(-10.4%), 통신(-4.8%) 업종에서는 고용 인원이 감소했다. 특히, IT·전기전자 업종에서 고용 인원이 8880명 늘어난데 비해 유통 업종에서는 1만1336명이 줄어 코로나19의 영향이 극명하게 대비됐다.', '기업별로 보면 삼성전자의 고용 인원이 8606명 늘어 가장 많이 증가했다. 이어 현대자동차(2018명), SK하이닉스(1550명), 코웨이(1488명), 롯데케미칼(1309명), LG이노텍(1288명) 등의 순이었다. 현대자동차와 LG이노텍은 정규직은 줄고 비정규직의 고용인원이 증가하면서 전체 고용 인원이 늘었다.', '고용 증가율은 SK이노베이션 37.5%(764명), 네이버 24.7%(885명), 엔씨소프트 23.7%(876명), 카카오 14.9%(426명) 순이었다.', '반면 롯데쇼핑은 2년 새 고용 인원이 5097명 줄었다. 이어 CJ CGV 3722명, GS리테일 1826명, LG디스플레이 1619명, KT 1462명, 대한항공 1290명, GS건설 1218명, 이마트 1142명 순으로 감소폭이 컸다.', '사상 최대의 이자 수익을 누리고 있는 은행들도 지난 2년간 광주은행과 기업은행을 제외하고는 대부분 고용인원이 감소했다. 우리은행이 829명, 하나은행이 729명, 신한은행이 535명, 국민은행이 501명 줄었다.']"
국내 R&D 1000대 기업 지난해 투자액 55조원···삼성전자 18조,2021.11.22 08:35,"['지난해 국내 1000대 기업의 연구개발(R&D) 투자액은 총 55조4000억원으로 전년 대비 3.35% 증가한 것으로 나타났다.', '한국산업기술진흥원(KIAT)은 2020년 R&D 투자 상위 1000대 기업을 대상으로 시행한 ‘R&D 스코어보드 조사’ 결과를 22일 발표했다.', '조사에 따르면 지난해 기준 1000대 기업의 매출액 대비 R&D 투자 비중은 4.53%로 전년 대비 0.24%포인트 증가했다.', '기업의 R&D 투자 비중은 2010년 2.79%에서 2013년 3.16%, 2019년 4.29%로 지난 10년간 꾸준히 늘었다.', '기업 규모별로는 종업원 1000명 이상 기업(192개)의 R&D 투자액이 47조4000억원으로 전체의 85.5%를 차지했다.', '다음으로 300명~999명 기업 4조6000억원(8.2%), 100~299명 2조5000억원(4.5%), 99명 이하 1조원(1.8%)순 이었다.', '99명 이하 기업의 R&D 투자액은 1조원으로 액수는 적었지만, 매출액 대비 R&D 투자 비중은 27.31%로 가장 높았다.', '업종별로는 1000대 기업 중 73.4%를 차지하는 제조업의 R&D 투자액이 49조4000억원(89.1%)으로 대부분을 차지했다.', '투자액 증가율은 전문·과학 및 기술서비스업이 23.2%로 가장 컸다.', '매출액 대비 투자 비중은 전문·과학 및 기술서비스업 24.37%, 농업·임업·어업 21.15%, 제조업 5.41%, 출판·영상·방송통신·정보서비스업 3.96%, 금융 및 보험업 3.49%, 하수·폐기물 처리·원료재생 및 환경복원업 2.99% 등의 순이었다.', 'R&D 투자 1조원 이상 기업은 9개로 나타났으며, 해당기업들의 R&D 투자는 34.2조원으로 1000대 기업 전체의 61.7%를 차지했다', 'R&D 투자액 1조원 이상인 기업은 삼성전자(17조8000억원), SK하이닉스(3조4000억원), LG전자(3조원), 현대자동차(2조8000억원), 삼성디스플레이(2조원), 기아(1조7000억원), LG디스플레이(1조4000억원), 현대모비스(1조원), LG화학(1조원) 등이었다. 이들 기업의 R&D 투자는 총 34조2000억원으로 1000대 기업 R&D 투자액의 61.7%를 차지했다.', '석영철 KIAT 원장은 “코로나19에 따른 불확실성 확대에도 민간 R&D 투자를 선도하는 상위 1000대 기업의 R&D 투자액, 매출액 대비 R&D 투자 비율 등이 증가세인 점은 긍정적 신호”라며 “우리 기업의 적극적인 R&D 투자가 코로나19 이후 경제활력 회복의 마중물이 되기를 기대한다”고 말했다.']"
이게 얼마만이야…삼성전자·SK하이닉스 주가 급등,2021.11.22 16:20,"['올 3분기 나란히 최대 실적을 거두고도 부진했던 삼성전자와 SK하이닉스 주가가 반도체 업황 개선 기대에 22일 모처럼 큰 폭 올랐다.', '이날 유가증권시장에서 삼성전자는 전 거래일보다 5.20%(3700원) 오른 7만4900원에 거래를 마쳤다. 종가 기준으로 지난 9월28일(7만6300원) 이후 약 2개월 만의 최고치다. SK하이닉스는 전 거래일보다 7.17%(8000원) 상승한 11만9500원에 마감했다. 종가는 지난 8월5일(12만원) 이후 가장 높은 수준이다. 일일 주가 상승률로 봤을 때 삼성전자는 올해 1월 8일(7.12%) 이후, SK하이닉스는 2월 25일(9.19%) 이후 각각 최대를 기록했다.', '이날 외국인이 삼성전자와 SK하이닉스를 각각 4282억원, 2834억원 순매수하면서 집중적으로 사들였다. 외국인 코스피 순매수 금액 7976억원의 대부분을 두 종목이 차지했다. 기관은 삼성전자를 2255억원, SK하이닉스를 1816억원 순매수했다.', '‘대장주’ 삼성전자와 SK하이닉스 주가가 급등하면서 이날 코스피도 전거래일보다 1.42% 오른 3013.25에 마감, 14거래일만에 3000선을 회복했다.', '삼성전자와 SK하이닉스는 3분기 호실적에도 D램 가격 하락세 진입에 따른 반도체 업황 둔화 전망의 영향으로 최근 주가 흐름이 부진했다. 그러나 지난주부터 메모리 반도체 업황에 대한 긍정적 전망이 나오면서 주가도 반등에 성공한 것으로 풀이된다. 내년 상반기에 메모리 가격이 바닥을 치고, 마이크로소프트와 메타(옛 페이스북) 등이 메타버스 구축용 서버 투자에 나서면서 수요가 증가할 것이라는 내용이다.', '반도체 업황 개선 기대가 커지면서 지난 19일(현지시간) 미국 증시에서 마이크론은 7.80% 급등했고, 이날 삼성전자와 SK하이닉스도 동반 상승했다. 김동원 KB증권 연구원은 “삼성전자와 SK하이닉스 주가는 고점 대비 평균 30% 이상 하락했고 10개월간 조정기를 거치면서 투자자들의 우려를 선반영했다”며 “4분기부터는 주가 반등이 본격화할 것”이라고 예상했다.']"
소비자물가 상승…경기 회복세 ‘뚜렷’,2021.11.22 21:26,"['에너지값 상승 여파로 세종을 제외한 전국의 모든 시·도에서 올 3분기 물가가 상승한 것으로 나타났다. 전국 기준 소비자물가가 2.6% 상승하며 2012년 1분기(3.0%) 이후 9년 반 만에 최대 상승폭을 기록했다.', '22일 통계청이 발표한 ‘2021년 3분기 지역경제 동향’을 보면 3분기 전국 소비자물가지수는 전년 동기 대비 2.6% 올랐다. 소비자물가지수를 조사하지 않는 세종을 제외한 전국 16개 시·도에서 모두 상승했다. 석유류(21.1%), 개인서비스(2.7%), 외식(2.8%), 축산물(12.7%) 등이 오르면서 전체 소비자물가지수를 끌어올렸다.', '지역별로 보면 물가는 제주(3.2%), 전북(3.2%), 강원(3.0%) 순으로 상승했다. 제주는 석유류(22.2%), 외식(3.2%), 농산물(8.1%), 축산물(12.9%), 전북은 석유류(21.6%), 개인서비스(2.8%), 외식(3.2%), 농산물(6.6%) 상승폭이 높았다. 반면 서울(1.9%)은 유일하게 1%대로 가장 낮은 상승률을 기록했다. 공공서비스(-0.5%), 섬유제품(-1.3%), 출판물(-0.4%) 가격이 내려간 영향이다. 서울을 제외하면 전국 평균보다 물가가 낮은 지역은 인천(2.5%), 부산(2.5%)뿐이었다.', '물가와 달리 올 3분기에 생산, 소비, 고용 등 주요 실물 지표는 개선세를 보였다. 3분기 전국 광공업생산은 전년 동기 대비 5% 증가했다. 경기·충북(반도체·전자부품, 전기장비)과 서울(기계장비, 의복·모피)의 생산은 각각 12.4%, 10.5%, 8.4% 늘어 상대적으로 높은 증가폭을 기록했다.', '서비스업 생산은 모든 지역에서 늘면서 전국적으로 3.9% 증가했다. 2013년 이래 최대 증가폭이다. 운수·창고업이 집중된 인천(4.7%)·부산(4.4%)과 금융·보험업이 밀집된 서울(4.3%)이 전국 평균보다 증가율이 컸다. 소비(소매판매)도 대부분의 지역에서 늘었는데 인천(1.1%)은 2019년 4분기 이래 처음으로 증가세로 전환했다.', '다만, 자동차 주요 생산지역인 울산은 반도체 대란에 생산 차질을 빚으면서 지역 경제가 몸살을 앓고 있다. 지난 1~4분기 내내 마이너스대를 기록하다가 올해 들어 증가세를 유지했던 광공업생산은 올 3분기 다시 -2.2%로 떨어졌다. 자동차 생산 차질을 빚은 광주(-8.7%)와 담배 수출이 부진했던 대전(-9.9%)도 광공업생산이 전년 대비 줄었다.']"
공원 안에 자리 잡은 ‘한화 포레나 청주매봉’ 1849가구,2021.11.21 21:33,"['한화건설은 오는 12월 중 충북 청주시 모충동 산 62-10번지 일원에 ‘한화 포레나 청주매봉’을 분양한다고 밝혔다. 한화 포레나 청주매봉은 지하 2층~지상 29층, 21개 동, 전용면적 74~104㎡의 총 1849가구 규모로 조성된다. 전용면적별로는 △74㎡A 246가구 △74㎡B 49가구 △84㎡A 896가구 △84㎡B 366가구 △104㎡ 292가구다.', '단지는 총면적 29만5764㎡로 청주 최대 규모 도시공원이 될 예정인 매봉공원 안에 위치해 있다. 차량을 통해 모충로, 청남로 등 청주 각 지역으로 이동 가능하다. 단지 인근에 13개 노선이 운행하는 버스정류장이 있다. SK하이닉스·LG전자 등이 입주해 있는 청주일반산업단지, 오창테크노폴리스 등 산업단지로의 이동이 가능하다. 모충초, 운호중·고, 충북여중·고 등을 도보로 통학할 수 있다.']"
"한국씨티은행, 환경 금융 확대, 대기업·ESG전문가 화상회의 개최",2021.11.18 19:39,"['한국씨티은행은 최근 기업의 관심과 중요성이 높아지는 ESG와 관련하여 기업 고객의 믿을 수 있는 금융파트너가 되기 위한 다양한 서비스 및 상품을 제공하고 있다. 한국씨티은행 본사인 씨티그룹이 2021년 3월 2050년까지 탄소 순배출 제로를 목표로 천명하였으며 지난 7월 지속 가능한 미래를 위한 아시아의 기회라는 제목의 보고서를 발표하고 아시아 지역에서 환경 금융의 성장을 강조했다. 이러한 기조에 발맞춰 한국씨티은행은 ‘베스트 ESG 뱅크’를 2021년 전략 목표로 설정하고 ESG 금융 확대를 중점 추진하고 있다.', '먼저 2020년 하반기부터 대기업 고객들의 재무담당 임원과 씨티의 글로벌 ESG 전문가들 간의 화상회의를 개최하고 있다. 이를 통해 글로벌 시장에서 증대되고 있는 ESG의 중요성에 대해 상기시키고 관련 우수사례들을 살펴보는 등 국내 대기업들이 ESG와 관련해 빠르게 변화하는 시장환경에 발맞춰 대응할 수 있도록 적극 지원하고 있다.', '지난 2월에는 한국무역보험공사와 한국 기업의 수출 및 해외진출 지원 협력을 위한 업무협약을 체결하면서 소재·부품·장비, 신산업, 그린 에너지 및 그린 모빌리티 분야에서 수출을 촉진하는 사업에 대해서는 우대조건으로 대출을 공급하기로 했다. K-SURE는 해당 대출에 대한 우대조건의 보험보증을 제공하기로 했다. 이를 통해 한국씨티은행은 그린산업을 포함한 한국 미래 산업의 해외시장 선점을 적극 뒷받침할 예정이다.', '이와 함께 한국씨티는 글로벌 네트워크를 활용해 국내 기업, 금융기관 및 정책기관들의 ESG 관련 해외자금 조달에 선도적으로 기여하고 있다. 2021년 한국 발행사들이 시장의 풍부한 유동성을 십분 활용하고 향후 금리가 상승될 가능성 등을 고려해 해외채권시장에서 유리한 조건으로 자금을 성공리에 조달하고 있으며 특히 투자자와 발행사 모두 ESG에 대한 관심과 수요가 점점 증대하면서 많은 발행사들이 그린본드 혹은 지속가능채권 형태로 발행을 추진하고 있다. 민간회사로는 SK하이닉스와 SK이노베이션이 그린본드 형태로 해외채권을 성공리에 발행했고, 다수의 국내 은행 및 금융기관 그리고 정책기관들이 ESG 형태로 발행하고 있다.', '또 올 상반기 씨티는 아·태 지역에서 지속가능금융과 관련해 전년 동기 대비 400% 증가한 250억달러 이상의 실적을 올렸는데 이 중 한국씨티은행은 지역 내 최다 건수인 17건의 거래를 진행하였으며 잔액도 81억달러를 돌파했다.', '한국씨티은행은 지배구조와 관련해서도 국내 민간은행 최초 여성 은행장인 유명순 은행장을 비롯해 전체 임원 14명 중 여성이 6명으로 그 비율이 43%에 이르는 등 국내 기업에서 양성평등의 실천 사례로 손꼽히며 모범적인 지배구조의 모습을 보여왔다. 더불어 한국씨티은행은 지난 6월 ESG에 대한 인식 제고와 고객 니즈에 맞는 ESG 상품 및 서비스 제공을 위해 ESG협의회를 발족했다.']"
용인 SK하이닉스 반도체클러스터 사업부지 부동산 불법 투기 43명 적발,2021.11.17 11:06,"['경기 용인시 SK하이닉스 반도체클러스터 사업 지구에서 불법적으로 부동산 투기를 한 기획부동산업자와 위장전입자들이 대거 적발됐다.', '경기도 공정특별사법경찰단은 지난해 12월부터 올해 10월까지 용인시 처인구 SK하이닉스 반도체클러스터 사업지구 일대의 토지거래허가 과정에 대한 기획수사를 벌여 모두 43명을 적발해 모두 검찰에 송치했다고 17일 밝혔다.', '이들이 불법 투기에 투입한 자금은 198억원으로, 이중 단기 시세차익을 노린 5개 농업회사법인 형태의 기획부동산의 경우 28억원의 시세차익을 얻은 것으로 확인됐다.', '농업회사법인 형태의 기획부동산 대표 A씨는 2019년 4월 토지거래허가구역내 11필지(1만6018㎡)를 28억6000만원에 사들인 뒤 이중 5필지를 허위 매매계약서를 이용해 20필지로 분할했다. A씨는 유튜브 등을 통해 주택이나 소매점 건축이 가능하다며 투자자들에게 허위로 홍보해 토지 매입후 1~8개월 사이 50억2000만원에 팔아 21억6000만원의 시세차익을 남겼다.', '이후 토지거래허가를 받지 못한 매수자들이 계약 해지를 요구하자 A씨는 법무법인 직원 B씨에게 2000만원을 주고 B씨 가족 명의의 주택·농지에 매수자 7명을 위장전입 시켰다. 결국 토지 매수자 7명은 위장전입·명의신탁·위탁경영 등 혐의로 검찰에 송치됐다.', 'C씨(천안 거주)는 2019년 2월 토지거래허가때 거주지 조건을 갖추기 위해 농지에 설치된 비닐하우스에 위장전입해 허가를 받고는 농지를 위탁경영했다. C씨를 포함해 29명은 이와 유사한 방법으로 토지거래허가구역에 위장전입한 뒤 34필지를 불법적으로 거래허가를 받았다.', '명의신탁에 의한 불법 토지거래허가 취득 행위도 적발됐다. D씨(수원 거주)는 2019년 4월 토지거래허가구역내 거주지 요건을 갖추지 못하자 해당 물건을 중개한 중개사무소의 중개보조원 명의를 빌려 토지거래허가를 취득했다. 구독자 수만명의 유튜버 E씨는 관할 관청에 중개사무소의 개설 등록을 하지 않고 중개의뢰인과 매수인들에게 무등록 중개해 1억1600만원의 수수료를 챙겼다.', '토지거래허가구역에서 매매 허가를 받으려면 토지이용 의무기간, 직접 영농, 직접 거주 등의 조건이 필요하지만 이들은 농업회사법인 형태로 기획부동산을 운영하거나 위장전입 또는 명의신탁 등의 방법으로 토지거래허가를 불법 취득했다. 토지거래허가구역내에서 부정한 방법으로 허가를 받으면 2년 이하의 징역 또는 계약 체결 당시의 개별공시지가에 따른 해당 토지가격의 100분의 30에 해당하는 금액 이하의 벌금에 처한다. 부정 허가로 밝혀지면 허가가 취소된다.', '경기도 관계자는 “앞으로도 부동산 시장 교란행위를 차단하고 실수요자 중심의 시장 질서가 확립되도록 수사를 강화할 방침”이라며 “토지거래허가구역내 외국인과 법인의 불법 투기 행위에 대해서도 수사 중인데 그 결과를 연말에 발표할 예정”이라고 말했다.']"
